{
  "$schema": "https://json-schema.org/draft/2020-12/schema",
  "$id": "diagnostics.schema.json",
  "title": "Blogger Diagnostics Catalog Schema",
  "description": "JSON Schema specification for the Blogger diagnostics catalog.",
  "type": "object",
  "required": [
    "$schema",
    "title",
    "description",
    "version",
    "rules"
  ],
  "properties": {
    "$schema": {
      "type": "string"
    },
    "title": {
      "type": "string"
    },
    "description": {
      "type": "string"
    },
    "version": {
      "type": "string"
    },
    "rules": {
      "type": "object",
      "additionalProperties": {
        "$ref": "#/$defs/diagnosticRule"
      }
    }
  },
  "additionalProperties": false,
  "$defs": {
    "diagnosticRule": {
      "type": "object",
      "required": [
        "code",
        "name",
        "category",
        "severity",
        "message",
        "evidence",
        "verifiedAt"
      ],
      "properties": {
        "code": {
          "type": "string",
          "pattern": "^BX[0-9]{4}$"
        },
        "name": {
          "type": "string"
        },
        "category": {
          "type": "string",
          "enum": [
            "hallucination",
            "syntax",
            "expressions",
            "quota",
            "structure",
            "deprecation",
            "runtime"
          ]
        },
        "severity": {
          "type": "string",
          "enum": [
            "error",
            "warning",
            "info"
          ]
        },
        "message": {
          "type": "string"
        },
        "replacement": {
          "type": "string"
        },
        "evidence": {
          "type": "string",
          "enum": [
            "official",
            "observed",
            "approximate",
            "unknown"
          ]
        },
        "verifiedAt": {
          "type": "string",
          "format": "date"
        }
      },
      "additionalProperties": false
    }
  }
}
